{
  "schema_version": 1,
  "locality": {
    "id": "fixture-city",
    "name": "Fixture City (synthetic)",
    "council_url": "https://fixture-city.example.invalid/"
  },
  "bins": [
    {
      "id": "recycling",
      "label": "Recycling (blue lid)"
    },
    {
      "id": "food_and_garden",
      "label": "Food and garden (green lid)"
    },
    {
      "id": "garbage",
      "label": "Garbage (red lid)"
    },
    {
      "id": "drop_off",
      "label": "Drop-off centre"
    },
    {
      "id": "hazardous_drop_off",
      "label": "Hazardous waste drop-off"
    }
  ],
  "fixture": true,
  "entries": [
    {
      "id": "pizza_box",
      "name": "Pizza box",
      "aliases": [
        "pizza carton",
        "takeaway pizza box"
      ],
      "material": "cardboard",
      "bin": null,
      "conditions": [
        {
          "when": {
            "food_soiled": true
          },
          "bin": "food_and_garden",
          "prep_steps": [
            "Tear the box to fit; greasy cardboard goes in with food scraps."
          ],
          "priority": 1
        },
        {
          "when": {
            "food_soiled": false
          },
          "bin": "recycling",
          "prep_steps": [
            "Flatten the box."
          ],
          "priority": 1
        }
      ],
      "questions": {
        "food_soiled": "Is the box greasy or has food stuck to it?"
      },
      "prep_steps": [],
      "ask_council": false,
      "source": {
        "kind": "fixture",
        "url": "https://fixture-city.example.invalid/rules#pizza_box",
        "section": "Fixture City A-Z (synthetic): Pizza box",
        "retrieved_on": "2026-10-24",
        "verified_by": "fixture-generator",
        "verified_on": "2026-10-24"
      }
    },
    {
      "id": "cardboard_box",
      "name": "Cardboard box",
      "aliases": [
        "shipping box",
        "delivery box",
        "corrugated cardboard"
      ],
      "material": "cardboard",
      "bin": "recycling",
      "conditions": [],
      "questions": {},
      "prep_steps": [
        "Remove tape and flatten the box."
      ],
      "ask_council": false,
      "source": {
        "kind": "fixture",
        "url": "https://fixture-city.example.invalid/rules#cardboard_box",
        "section": "Fixture City A-Z (synthetic): Cardboard box",
        "retrieved_on": "2026-10-24",
        "verified_by": "fixture-generator",
        "verified_on": "2026-10-24"
      }
    },
    {
      "id": "plastic_film",
      "name": "Plastic film and bags",
      "aliases": [
        "plastic bag",
        "carrier bag",
        "cling film",
        "bubble wrap",
        "cellophane",
        "bread bag"
      ],
      "material": "plastic film",
      "bin": "drop_off",
      "conditions": [],
      "questions": {},
      "prep_steps": [
        "Bundle clean, dry film into one bag and take it to the drop-off centre film bank."
      ],
      "ask_council": false,
      "source": {
        "kind": "fixture",
        "url": "https://fixture-city.example.invalid/rules#plastic_film",
        "section": "Fixture City A-Z (synthetic): Plastic film and bags",
        "retrieved_on": "2026-10-24",
        "verified_by": "fixture-generator",
        "verified_on": "2026-10-24"
      }
    },
    {
      "id": "black_plastic_tray",
      "name": "Black plastic tray",
      "aliases": [
        "black food tray",
        "black meat tray",
        "black ready meal tray"
      ],
      "material": "plastic (black)",
      "bin": "garbage",
      "conditions": [],
      "questions": {},
      "prep_steps": [
        "Fixture City sorters cannot detect black plastic; scrape out food first."
      ],
      "ask_council": false,
      "source": {
        "kind": "fixture",
        "url": "https://fixture-city.example.invalid/rules#black_plastic_tray",
        "section": "Fixture City A-Z (synthetic): Black plastic tray",
        "retrieved_on": "2026-10-24",
        "verified_by": "fixture-generator",
        "verified_on": "2026-10-24"
      }
    },
    {
      "id": "lined_paper_cup",
      "name": "Plastic-lined paper cup",
      "aliases": [
        "coffee cup",
        "takeaway coffee cup",
        "lined paper cup"
      ],
      "material": "paper with plastic lining",
      "bin": "garbage",
      "conditions": [],
      "questions": {},
      "prep_steps": [
        "Put a separate plastic lid in recycling."
      ],
      "ask_council": false,
      "source": {
        "kind": "fixture",
        "url": "https://fixture-city.example.invalid/rules#lined_paper_cup",
        "section": "Fixture City A-Z (synthetic): Plastic-lined paper cup",
        "retrieved_on": "2026-10-24",
        "verified_by": "fixture-generator",
        "verified_on": "2026-10-24"
      }
    },
    {
      "id": "unlined_paper_cup",
      "name": "Unlined paper cup",
      "aliases": [
        "plain paper cup",
        "water cooler cup"
      ],
      "material": "paper",
      "bin": "food_and_garden",
      "conditions": [],
      "questions": {},
      "prep_steps": [],
      "ask_council": false,
      "source": {
        "kind": "fixture",
        "url": "https://fixture-city.example.invalid/rules#unlined_paper_cup",
        "section": "Fixture City A-Z (synthetic): Unlined paper cup",
        "retrieved_on": "2026-10-24",
        "verified_by": "fixture-generator",
        "verified_on": "2026-10-24"
      }
    },
    {
      "id": "paper_plate",
      "name": "Unlined paper plate",
      "aliases": [
        "paper plate",
        "plain paper plate"
      ],
      "material": "paper",
      "bin": null,
      "conditions": [
        {
          "when": {
            "food_soiled": true
          },
          "bin": "food_and_garden",
          "priority": 1
        },
        {
          "when": {
            "food_soiled": false
          },
          "bin": "recycling",
          "priority": 1
        }
      ],
      "questions": {
        "food_soiled": "Is the plate greasy or does it have food on it?"
      },
      "prep_steps": [],
      "ask_council": false,
      "source": {
        "kind": "fixture",
        "url": "https://fixture-city.example.invalid/rules#paper_plate",
        "section": "Fixture City A-Z (synthetic): Unlined paper plate",
        "retrieved_on": "2026-10-24",
        "verified_by": "fixture-generator",
        "verified_on": "2026-10-24"
      }
    },
    {
      "id": "aerosol_can",
      "name": "Aerosol can",
      "aliases": [
        "aerosol",
        "spray can",
        "deodorant can",
        "air freshener can"
      ],
      "material": "metal (pressurised)",
      "bin": null,
      "conditions": [
        {
          "when": {
            "liquid_inside": false
          },
          "bin": "recycling",
          "prep_steps": [
            "Do not pierce or crush the can.",
            "Put the plastic cap in recycling."
          ],
          "priority": 1
        },
        {
          "when": {
            "liquid_inside": true
          },
          "bin": "hazardous_drop_off",
          "prep_steps": [
            "Keep the cap on; take it to the hazardous waste drop-off."
          ],
          "priority": 1
        }
      ],
      "questions": {
        "liquid_inside": "Is there still product or liquid inside the can?"
      },
      "prep_steps": [],
      "ask_council": false,
      "source": {
        "kind": "fixture",
        "url": "https://fixture-city.example.invalid/rules#aerosol_can",
        "section": "Fixture City A-Z (synthetic): Aerosol can",
        "retrieved_on": "2026-10-24",
        "verified_by": "fixture-generator",
        "verified_on": "2026-10-24"
      }
    },
    {
      "id": "small_electrical_device",
      "name": "Small electrical item",
      "aliases": [
        "electric toothbrush",
        "bluetooth speaker",
        "vape",
        "electronic toy",
        "hair dryer"
      ],
      "material": "mixed electronics",
      "bin": null,
      "conditions": [
        {
          "when": {
            "contains_battery": true
          },
          "bin": "hazardous_drop_off",
          "prep_steps": [
            "Built-in batteries can start bin-lorry fires; tape over any exposed terminals."
          ],
          "priority": 1
        },
        {
          "when": {
            "contains_battery": false
          },
          "bin": "drop_off",
          "prep_steps": [
            "Take it to the drop-off centre electricals bay."
          ],
          "priority": 1
        }
      ],
      "questions": {
        "contains_battery": "Does it have a built-in battery (rechargeable, or batteries you cannot take out)?"
      },
      "prep_steps": [],
      "ask_council": false,
      "source": {
        "kind": "fixture",
        "url": "https://fixture-city.example.invalid/rules#small_electrical_device",
        "section": "Fixture City A-Z (synthetic): Small electrical item",
        "retrieved_on": "2026-10-24",
        "verified_by": "fixture-generator",
        "verified_on": "2026-10-24"
      }
    },
    {
      "id": "mobile_phone",
      "name": "Mobile phone",
      "aliases": [
        "cell phone",
        "cellphone",
        "smartphone"
      ],
      "material": "mixed electronics",
      "bin": "drop_off",
      "conditions": [],
      "questions": {},
      "prep_steps": [
        "Wipe your data first; hand it in at the drop-off centre electricals counter."
      ],
      "ask_council": false,
      "source": {
        "kind": "fixture",
        "url": "https://fixture-city.example.invalid/rules#mobile_phone",
        "section": "Fixture City A-Z (synthetic): Mobile phone",
        "retrieved_on": "2026-10-24",
        "verified_by": "fixture-generator",
        "verified_on": "2026-10-24"
      }
    },
    {
      "id": "loose_battery",
      "name": "Loose battery",
      "aliases": [
        "battery",
        "batteries",
        "aa battery",
        "aaa battery",